{"$schema":"https://json-schema.org/draft/2020-12/schema","$id":"https://fs-gg.github.io/schemas/evidence/repair-receipts/v1","category":"repair-receipts","type":"object","required":["schema","repairId","unitId","state","digestContract","supersedes","implementation","review","exactHeadChecks","protectedMainChecks","postMergeQualification","evidence","boundaries","acceptedAt","digest"],"properties":{"schema":{"const":"fsgg.coordination.unit-repair-acceptance/1"},"repairId":{"type":"string","pattern":"^GS2-[0-9]{2}\\.[0-9]+-repair-[1-9][0-9]*$"},"unitId":{"type":"string","pattern":"^GS2-[0-9]{2}\\.[0-9]+$"},"state":{"const":"superseding-repair-accepted"},"digestContract":{"const":"canonical-json-without-digest-v1"},"supersedes":{"type":"object","required":["path","bytes","sha256","digest","sourceRevision"],"properties":{"path":{"type":"string","pattern":"^accepted/GS2-[0-9]{2}\\.[0-9]+\\.json$"},"bytes":{"type":"integer","minimum":1},"sha256":{"type":"string","pattern":"^[0-9a-f]{64}$"},"digest":{"type":"string","pattern":"^[0-9a-f]{64}$"},"sourceRevision":{"type":"string","pattern":"^[0-9a-f]{40}$"}},"additionalProperties":false},"previousRepair":{"type":"object","required":["path","bytes","sha256","digest","implementationMerge"],"properties":{"path":{"type":"string","pattern":"^repair-receipts/GS2-[0-9]{2}\\.[0-9]+-repair-[1-9][0-9]*\\.json$"},"bytes":{"type":"integer","minimum":1},"sha256":{"type":"string","pattern":"^[0-9a-f]{64}$"},"digest":{"type":"string","pattern":"^[0-9a-f]{64}$"},"implementationMerge":{"type":"string","pattern":"^[0-9a-f]{40}$"}},"additionalProperties":false},"implementation":{"type":"object","required":["issue","pullRequest","candidateSha","candidateTreeSha","mergeSha","mergedAt"],"properties":{"issue":{"type":"integer","minimum":1},"pullRequest":{"type":"integer","minimum":1},"candidateSha":{"type":"string","pattern":"^[0-9a-f]{40}$"},"candidateTreeSha":{"type":"string","pattern":"^[0-9a-f]{40}$"},"mergeSha":{"type":"string","pattern":"^[0-9a-f]{40}$"},"mergedAt":{"type":"string","format":"date-time"}},"additionalProperties":false},"review":{"type":"object","required":["critic","decisionCommentId","decisionUrl","decisionDigest","waitCommentId","hostAcceptanceCommentId","hostAcceptanceDigest"],"properties":{"critic":{"type":"string","minLength":1},"decisionCommentId":{"type":"integer","minimum":1},"decisionUrl":{"type":"string","minLength":1},"decisionDigest":{"type":"string","pattern":"^[0-9a-f]{64}$"},"waitCommentId":{"type":"integer","minimum":1},"hostAcceptanceCommentId":{"type":"integer","minimum":1},"hostAcceptanceDigest":{"type":"string","pattern":"^[0-9a-f]{64}$"}},"additionalProperties":false},"exactHeadChecks":{"type":"array","minItems":2,"maxItems":2,"uniqueItems":true,"items":{"$ref":"#/$defs/workflowRun"}},"protectedMainChecks":{"type":"array","minItems":2,"maxItems":2,"uniqueItems":true,"items":{"$ref":"#/$defs/workflowRun"}},"postMergeQualification":{"type":"object","required":["checkoutSha","buildWarnings","buildErrors","unitPassed","unitFailed","architecturePassed","architectureFailed","q3Controls","q7Controls","repositories","fleetEnabled","seal"],"properties":{"checkoutSha":{"type":"string","pattern":"^[0-9a-f]{40}$"},"buildWarnings":{"type":"integer","minimum":0},"buildErrors":{"type":"integer","minimum":0},"unitPassed":{"type":"integer","minimum":1},"unitFailed":{"type":"integer","minimum":0},"architecturePassed":{"type":"integer","minimum":1},"architectureFailed":{"type":"integer","minimum":0},"q3Controls":{"type":"integer","minimum":1},"q7Controls":{"type":"integer","minimum":1},"repositories":{"type":"integer","minimum":1},"fleetEnabled":{"type":"boolean"},"seal":{"type":"string","pattern":"^[0-9a-f]{64}$"}},"additionalProperties":false},"authorityProof":{"type":"object","required":["checkoutSha","baseRevision","currentRevision","settingsSha256","queuedHead","selectionClosure","productionMutation"],"properties":{"checkoutSha":{"type":"string","pattern":"^[0-9a-f]{40}$"},"baseRevision":{"type":"string","pattern":"^[0-9a-f]{40}$"},"currentRevision":{"type":"string","pattern":"^[0-9a-f]{40}$"},"settingsSha256":{"type":"string","pattern":"^[0-9a-f]{64}$"},"queuedHead":{"type":"string","pattern":"^(none|[0-9a-f]{40})$"},"selectionClosure":{"type":"array","minItems":1,"uniqueItems":true,"items":{"enum":["build","test","policy","coordination","packaging","release"]}},"productionMutation":{"const":false},"inventorySha256":{"type":"string","pattern":"^[0-9a-f]{64}$"},"requestSha256":{"type":"string","pattern":"^[0-9a-f]{64}$"},"sourceRequestSha256":{"type":"string","pattern":"^[0-9a-f]{64}$"}},"additionalProperties":false},"evidence":{"type":"object","required":["observations","sdd"],"properties":{"observations":{"type":"object","required":["path","bytes","sha256","repositories","runs","jobs"],"properties":{"path":{"type":"string","minLength":1},"bytes":{"type":"integer","minimum":1},"sha256":{"type":"string","pattern":"^[0-9a-f]{64}$"},"repositories":{"type":"integer","minimum":1},"runs":{"type":"integer","minimum":1},"jobs":{"type":"integer","minimum":1}},"additionalProperties":false},"sdd":{"type":"object","required":["generator","version","analysisSha256","workModelSha256","verifySha256","shipVerdictSha256"],"properties":{"generator":{"type":"string","minLength":1},"version":{"type":"string","minLength":1},"analysisSha256":{"type":"string","pattern":"^[0-9a-f]{64}$"},"workModelSha256":{"type":"string","pattern":"^[0-9a-f]{64}$"},"verifySha256":{"type":"string","pattern":"^[0-9a-f]{64}$"},"shipVerdictSha256":{"type":"string","pattern":"^[0-9a-f]{64}$"}},"additionalProperties":false},"roadmap":{"type":"object","required":["manifestSha256","candidateSha","candidateTreeSha","q3Controls","q7Controls","stoppedAtUnitBoundary"],"properties":{"manifestSha256":{"type":"string","pattern":"^[0-9a-f]{64}$"},"candidateSha":{"type":"string","pattern":"^[0-9a-f]{40}$"},"candidateTreeSha":{"type":"string","pattern":"^[0-9a-f]{40}$"},"q3Controls":{"type":"integer","minimum":1},"q7Controls":{"type":"integer","minimum":1},"stoppedAtUnitBoundary":{"const":true}},"additionalProperties":false}},"additionalProperties":false},"boundaries":{"type":"object","required":["productionMutation","fleetEnablement","consumerMutation","packageOrRelease","gs2068"],"properties":{"productionMutation":{"type":"boolean"},"fleetEnablement":{"type":"boolean"},"consumerMutation":{"type":"boolean"},"packageOrRelease":{"type":"boolean"},"gs2068":{"type":"boolean"}},"additionalProperties":false},"operationalDecision":{"type":"object","required":["schema","sha256","fullSuite","missedObligation","missedObligations","fleetSelection","productionMutation","q7Seal"],"properties":{"schema":{"const":"fsgg.coordination.workflow-selection-sentinel/1"},"sha256":{"type":"string","pattern":"^[0-9a-f]{64}$"},"fullSuite":{"const":"passed"},"missedObligation":{"const":false},"missedObligations":{"type":"array","maxItems":0},"fleetSelection":{"const":"eligible"},"productionMutation":{"const":false},"q7Seal":{"type":"string","pattern":"^[0-9a-f]{64}$"}},"additionalProperties":false},"acceptedAt":{"type":"string","format":"date-time","pattern":"^[0-9]{4}-[0-9]{2}-[0-9]{2}T[0-9]{2}:[0-9]{2}:[0-9]{2}Z$"},"digest":{"type":"string","pattern":"^[0-9a-f]{64}$"}},"additionalProperties":false,"$defs":{"workflowRun":{"type":"object","required":["workflow","runId","url","headSha","conclusion"],"properties":{"workflow":{"enum":["Bootstrap qualification","CodeQL"]},"runId":{"type":"integer","minimum":1},"url":{"type":"string","minLength":1},"headSha":{"type":"string","pattern":"^[0-9a-f]{40}$"},"conclusion":{"const":"success"}},"additionalProperties":false}}}
