{"schema":"fsgg.coordination.unit-repair-acceptance/1","repairId":"GS2-06.7-repair-272","unitId":"GS2-06.7","state":"superseding-repair-accepted","digestContract":"canonical-json-without-digest-v1","supersedes":{"path":"accepted/GS2-06.7.json","bytes":2242,"sha256":"9a98a13213c9a6934b362a6cb75dc3b523800205961e76cd4de984157733dc0b","digest":"c6d1662e7df93f8b6ca8f577b5143e1e8a45eb9ac6fe55922488659ff9363036","sourceRevision":"3277a7a581f9b75001a851e0b614de3c1eadf812"},"previousRepair":{"path":"repair-receipts/GS2-06.7-repair-268.json","bytes":3171,"sha256":"37d36961589dbcd5db2b1d9deab09932dc9204fedaddb618eea5be6dfddbfd27","digest":"f0360e50a1c94262d8c1b83a12871276c8b1c58e6efceba14b49926dca00d45d","implementationMerge":"286bde7afd607ac8e62a4ca71f6f82d363c052b4"},"implementation":{"issue":272,"pullRequest":273,"candidateSha":"0705405ff76eaf5cf34b627017a40240396616f9","candidateTreeSha":"db42165acbb6e0f0ee3dee4f0b63990f63c12c96","mergeSha":"588e1a4bcceeef1cc5a110c924aa52636f263b07","mergedAt":"2026-09-03T07:09:48Z"},"review":{"critic":"successor-273-r1","decisionCommentId":5521926908,"decisionUrl":"https://github.com/FS-GG/FS.GG.Coordination/pull/273#issuecomment-5521926908","decisionDigest":"604e7c479baee9985e7d62df89bd3ed4732b079bd41ca118bc3a3120a6daaa54","waitCommentId":5521928736,"hostAcceptanceCommentId":5521933056,"hostAcceptanceDigest":"ec7c842c2b1f09eaf6bcf8e4a49a99bd64ca35136dbd97d4b7fe05b866ce1e9c"},"exactHeadChecks":[{"workflow":"Bootstrap qualification","runId":33725627516,"url":"https://github.com/FS-GG/FS.GG.Coordination/actions/runs/33725627516","headSha":"0705405ff76eaf5cf34b627017a40240396616f9","conclusion":"success"},{"workflow":"CodeQL","runId":33725618051,"url":"https://github.com/FS-GG/FS.GG.Coordination/actions/runs/33725618051","headSha":"0705405ff76eaf5cf34b627017a40240396616f9","conclusion":"success"}],"protectedMainChecks":[{"workflow":"Bootstrap qualification","runId":33726702726,"url":"https://github.com/FS-GG/FS.GG.Coordination/actions/runs/33726702726","headSha":"588e1a4bcceeef1cc5a110c924aa52636f263b07","conclusion":"success"},{"workflow":"CodeQL","runId":33726701922,"url":"https://github.com/FS-GG/FS.GG.Coordination/actions/runs/33726701922","headSha":"588e1a4bcceeef1cc5a110c924aa52636f263b07","conclusion":"success"}],"postMergeQualification":{"checkoutSha":"588e1a4bcceeef1cc5a110c924aa52636f263b07","buildWarnings":0,"buildErrors":0,"unitPassed":189,"unitFailed":0,"architecturePassed":466,"architectureFailed":0,"q3Controls":23,"q7Controls":12,"repositories":10,"fleetEnabled":false,"seal":"34cc3b592c9a67d26814cea8768b1864071ff261204d56d42ef8d38bcfbe8ad2"},"authorityProof":{"checkoutSha":"588e1a4bcceeef1cc5a110c924aa52636f263b07","baseRevision":"6d3b7662ac4d9474a9976ac093ec910f55fb6087","currentRevision":"588e1a4bcceeef1cc5a110c924aa52636f263b07","settingsSha256":"5c7cd805ec9924c1895749df66fc0fd49eedbfeadd8721baafd75ced79a89518","queuedHead":"none","selectionClosure":["policy","coordination"],"productionMutation":false},"evidence":{"observations":{"path":"gs2-06-7/observed-workflow-runs.json","bytes":61337,"sha256":"396645252215e6ff1d904d15cd3667530bf30ce93482df735a9f3ae94c8a5439","repositories":10,"runs":80,"jobs":305},"sdd":{"generator":"FS.GG.SDD.Artifacts","version":"1.0.0","analysisSha256":"34b2b4ba59a99e369dd2231904088129d2829bd93bcd7d9f3074c69480ab65cb","workModelSha256":"3ab5563f2e12b63dfb3ba4b81a7df979d04225cba2f3e587199ac55a9230a3d8","verifySha256":"0cda3aad4f8d5737ffa1d02dc98bc53714f1801fe3f1228159db132aa7b19b2c","shipVerdictSha256":"361b3af0e5d7c8876ee46e8fb92f94d56f5ca58831e122f089fa626ed7001768"}},"boundaries":{"productionMutation":false,"fleetEnablement":false,"consumerMutation":false,"packageOrRelease":false,"gs2068":false},"acceptedAt":"2026-09-03T07:19:56Z","digest":"e7d660e32f8f94762f9556ddf3552f343eb1fea6d4d53e3258b79b7387e4e3bf"}
